Article	|	Name	|	Price
Артикул: DO0751-100	|	Кроссовки AIR JORDAN 11 CMFT LOW	|	5 199 грн.
Артикул: DM9096-101	|	Кроссовки NIKE AIR FORCE 1	|	4 549 грн.
Артикул: DC9402-800	|	Кроссовки NIKE AIR MAX PRE-DAY	|	5 349 грн.
Артикул: DB2576-001	|	Кроссовки NIKE AF1/1	|	5 749 грн.
Артикул: CZ0599-106	|	Кроссовки NIKE M AIR ZOOM SUPERREP 2 NN	|	2 499 грн.
Артикул: CW7585-100	|	Кроссовки NIKE BLAZER LOW LEATHER	|	2 999 грн.
Артикул: CV8129-001	|	Кроссовки JORDAN SERIES 01	|	3 329 грн.
Артикул: 864349-302	|	Кроссовки NIKE SB ZOOM BLAZER MID	|	3 499 грн.
Артикул: 555088-611	|	Кроссовки AIR JORDAN 1 RETRO HIGH OG	|	6 579 грн.
Артикул: DB4109-200	|	Кроссовки NIKE AIR FORCE 1 LUXE	|	5 749 грн.
Артикул: CZ1528-001	|	Кроссовки NIKE AIR FORCE 1 EXPERIMENTAL	|	4 999 грн.
Артикул: BQ6817-700	|	Кроссовки NIKE SB DUNK LOW PRO	|	4 149 грн.
Артикул: CZ4052-001	|	Кроссовки NIKE LEBRON WITNESS VI	|	4 549 грн.
Артикул: CZ0327-100	|	Кроссовки NIKE AIR FORCE 1 07 LX	|	4 549 грн.
Артикул: DC8903-300	|	Кроссовки NIKE SB ZOOM BLAZER MID PRM	|	4 549 грн.
Артикул: DC8903-301	|	Кроссовки NIKE SB ZOOM BLAZER MID PRM	|	4 549 грн.
Артикул: 865031-009	|	Ботинки NIKE AIR MAX GOADOME	|	7 379 грн.
Артикул: DM8150-100	|	Кроссовки NIKE Air More Uptempo	|	6 579 грн.
Артикул: CV5980-700	|	Кроссовки NIKE SB BRUIN REACT T	|	4 179 грн.
Артикул: CZ0191-001	|	Кроссовки NIKE AIR MAX 95	|	6 979 грн.
Артикул: DC9412-001	|	Кроссовки NIKE AIR MAX 95	|	6 979 грн.
Артикул: DD1391-004	|	Кроссовки NIKE DUNK LOW RETRO	|	4 149 грн.
Артикул: H05319	|	Кроссовки ADIDAS ZX 2K BOOST UTILITY	|	7 499 грн.
Артикул: G54896	|	Кроссовки ADIDAS ZX 2K BOOST UTILITY	|	7 499 грн.
